{
  "artifact_type": "dataset",
  "case_count": 1000,
  "config_sha256": "04ffaf7dcb027482d82c921fa617a429872a06e5d0a92545e3cfaf724a011333",
  "dataset_id": "4aefbbe88a18d233249b",
  "dataset_sha256": "4aefbbe88a18d233249bae3dbebc529142a0e9d5dbaaf33dae474c82f121fa28",
  "design_sha256": "352a060bdb7ef2ff3e9432d7eff4333d6d3c9bd9aca33c6f29f6f56a307250c1",
  "lock_sha256": "181b61f84e84aa57e5a373373de9b556c033d9510ceb98dfc78110a0e38bbb90",
  "manifest_schema_sha256": "8edf18669d4b22b1af7d84e59c45d1665e000c86f40d5701d13b1d5ed8232f5c",
  "manifest_sha256": "4a11f40a18f253554ca04cd3e4564cf95f0efc06cf19082bc0dddb60a37ae504",
  "parent_run_sha256": [
    "cc976e00b2152af33e43f2465a6f40c9036078d35f85366f64b8f40aefd5fd67",
    "7bee20a1c23575a63359c769b15f1542429efd0958eefb58974d3fa14d8085fa",
    "d1b564f9050159ffa26c645d9be75cfffb0b5e0e77e7089c359b101253c69f29",
    "6821b8e72a1e7d2da287eaf96f2555d7916ee4787064bcfa054868d8f894533c",
    "76808b4baa267b7e71d95c74e3afc82648dd5ca4e0d87be7f483873f52c4453f",
    "63b6790a5ffbc640ecaf1d1922f0a8004b1e03dadcb47fd9b1a55f03e62d1a8f",
    "8e7bd4b74bb7b90e378ed881e2dc0728d527a4726692c74acda96032f6c4b400",
    "40b7eed208f46589d5c3a8340dcb2dacc42404c858959f20ca2de83f109b7bba",
    "6e0b61b1bf7a5865ddcdf579de4a04f875f58daaea898d55a081b14149b9f3ed",
    "c94a75efdf1a3cd0861de99d8e3231eb5090d732e27e314287d0f9763d61e2f7",
    "c8cc3b98a1dfa5e52e00771a93c873f5eb1da39179db7dcb197e1e66e1edfcb2",
    "c7d8b63f616059c8cb90f6967a7ebf1cb5170dcbf10d3b418034568401d57ee5",
    "b280633f737ffa39e2663f3b794a688b3d9e61f2b104f0c7eda5fec0d705f329",
    "a85755fd8b68c02959ff5e7e53f866ffcc2d530c3ce5027b322a7087494928c4",
    "28213933d9bb9a743b13e43c1a4611a5823c53fe2843d0fcdfda7e52a58e94d3",
    "41cba047e7a0e3247106ec70eb0c4f0013e306d63b3d69fc80b8a254558f8d4f",
    "9a4c636cde210b69e708672c6821c7c3a866a670bf6d02d99a37f9314f85e474",
    "b63475fa6a77f1a19012dc2a9ac64e3b6758fc77ab3083ddc066f7f7b5d079cf",
    "4d61d5813dec0a4beb3169eb76a62973c68bf29f478d0d39387d5ecf8a545a59",
    "4740d4d401bf2ee6af4f1fd22403ec6d34690f39ff1827039b04481787263ec6",
    "33996e6ed8ca84eff98175f041c69b6b6b40bc8ab183fd809ae85450a5eec7a8",
    "c859e596295a03634be8bdd94c65962f4e427a4a76367161e12bb3cfd963a53a",
    "d76cf510d1ab9cc3c362103903067ea67bf55b2f3e8a6bf762ef62e38fd867c3",
    "c5ef71e9326d6397999fc1778d22b570bebfd8829f63a21d1380ecbf764cbf9b",
    "b816bafd2b4aba8b1985fdb0a169e3f2e9e29dc8e1585ddba6d9624e6c3ed3a5",
    "e07f9716d990ad55264e8386a481e5f8c6e663a2f926ff7e27f6b92fb7600820",
    "3ad819409f1e7eedb40072f4300be883613ba6d21cb901aa997fe16e9ff6ff6e",
    "25a69b7db1b9a47c2d1d200344a2945d2dfded5de06964985f3d61e0e4256f43",
    "8323f3d729bca73751bc7c89aa8b9f398725f86fd1adc368ffc11268518d7e13",
    "05b2129e96e8919c14bd314e374c993a2344d36083fbe7a52feda42faec90934",
    "f8ab5902b0ff03aad0935ac6946b76a66a8d1ca7a2073fa83da5a8843f756ada",
    "95026a7b4270b5940586e6c9ecb599592be260e9cdd4bf4a25175b2410379a75",
    "a97e52154ed6daf89af62227f546530e3c757436ebd8edda975a05191bf09e17",
    "a665ae4020e27ba0efcebd9bcac802065a2c75d07620e5c9f509b1774e3cdbec",
    "292c145ff13d26138556e1e6e2f2f6c2bdb530bb7db5c6d2cd3db5ab8a404328",
    "71704810ef1827ecb3fd49d48d90ed1e7a3c8583f0187c1fb7a22a32ff60517b",
    "2866468520127ae9829294d66319d73e9489547e7dc501497bca84ee89abdf21",
    "19e0d3714aea08cd2640ba2a494ead8183194455d6ebeaf4b6b64911738bd8cb",
    "4be2ef19750996ddbab148ce7c77d7cd61e8fc5271237ea76c0d04603c44a75b",
    "e8a5f4df1d07b0a2e0694a56cca852bd61438050ea8f9491d014993375b6cf33",
    "55155bd32e3c821d28f2fb77728f871b2ffbbf8bc0772f88e9f38a154323c6f5",
    "0df162d3821a821e3615d4726734211ddad539fab9529dcf21293f5edcbcb6bd",
    "74bab0359765cff309eb4a3d515263d3a78eb431d063af2f40014dc460aff3ee",
    "a25ee18f789e7ab9d84996bbda3af2a1c48ce26c04c0b60a2ef0b7f6f2dc51a3",
    "c14606e3b29cd97dbb0e52f741c7fe50ed8071e66c9cb541816d118f487a11f5",
    "6b2ef572c88ddca8ac1006f8274ee778305832a9086defddc303b422f66df0a5",
    "4b40a658c01d8539c57d647b1733afb124c500a57c61a92c2bcf40c2cd46e214",
    "e31bd0a622864cef50dc80624b2bf940583e978c15e88e8ca0f4a58c1f483d7f",
    "0f84cc1b1ed3ea2dda616a551dff306cf3e1357673582bfbba8d5b2340099296",
    "d0eeada3e62551a3035c45f76ae4c8b5314f49be4e110ed523696bc55519788e",
    "d7f88e6bf0bf7120af53378318676e571a1aaedb0c9c1ea323a8c7d609168457",
    "28dbab8b0a4075baba0c184a826b984c3bde6f754466f241c6ecc71a20ea49a3",
    "a7916c0d48dfc736f3a191108710b11878e9a6401641b22152226bc673d5a00b",
    "22ee9d0e4209657a994928d9443da228f6ea9418a47300ca33ac84f7e9b2d20d",
    "ffd5f8f96b3f9e527051f8276d417252ce7322a767853468cda8d0619c49456d",
    "b466d9f35ccb330d2c80755da9dd87149217d5d2c0e656f1cfb200dd13d34b5f",
    "dbadac2cde51791566cdab5ff075d0174ae39e9ea83f1a40b331b6aff8962ba6",
    "17448af273b46a625d70f46ffe0ab686662719636dd0c7e4a19632e15d33d686",
    "0ef92dc28e2d779c0c26f11aa08686854247b13b4c19fd0fdc200fd8d134ab5c",
    "6fa0ca77b63b4f4f9ac4cc2607bb64bccf7182272f7d7835d503118f954b6465",
    "10b8d141ef887909de55979d018c553549afab4992524f28a4ed9718f4b4911a",
    "8c0ecb25ebefb75b8be186b5f1ceb3cb8a5a1890b4fc2e500cacec156578e1d2",
    "e2b13a6972142880147a4a8a72714faa65cede5cb5121c9427184b4e256c486a",
    "bff18d5fd008ce00a6f862320d1ce0679c9685b8e12daa306f18c76515f7ddf9",
    "8ada9ea806b5a7307b749ec5335135c36b8ba60e3763daffd8cceb6f3e74e534",
    "1d429592b90967542a5ad8d7617b613132bf738a0db44ec33b9c12a79e7ff558",
    "5019f023349cbe0f6f6a9ec0c8dc3479c12cbd1ad2c27e2970d7a3ea75678dc6",
    "f600a29e25d7184fa7ec758d3aa5d513850abd6b4c4fbe78b0322ef9e1e3e0e4",
    "a6fbe2019cf47cda980fddb00bf389ee5b5202a496d3521ec707ff0d0ce0675e",
    "b0130dde95c6b0124fd607c2f8514e0e6a6eb415eeacf2ee0902a227bd2152fd",
    "0c431bd0524f7b04600bf42134d0c133a84912c7918c9c685ff60fafed6c768e",
    "a7d46fc715fb1db5892bdae6cedbbb0905327df7e67bb2bd6ab4ea936a94ea7c",
    "789cc57bd631c011660b841afd23e8a9930cdab1b2f082f3932c87333f419ece",
    "cf0f54a63a11b91f811841cbfd2463169ec3b31969c6f565f0bbf29f8cb6175b",
    "6fdae6ad392eec74bc1ebe46944132b1b34f03e249530f667cd3d9847fe530ef",
    "f4be5e2d70cb04b1a04fb17500d3a7094e8b8a67f96f5dd9765a5d6017960ba6",
    "0e6bd4bfda3dbde37d99788cd5241ce2589a73c07b7ccb32c31d14eefa64443f",
    "45f52c6ae04bac00577b6d4db2294e42fa89c0815a467fe3a60ff164d5e7b0d5",
    "bcea729868b18fc3ea7153fe6974c37f6f957abd7f50d4fec0faa761910aed33",
    "7596fae12fc1ce674f77df8a4fe421ab819766157b696af8f5d9c49a842ea332",
    "125d32a4b3ec13c97f000ff7a35aff0057296b6988716f3860da8ba450f757a7",
    "8d8cb7976a376d65a6625385b4fc9114f6f9124fee6901614a4194caa547c8e1",
    "7931c98d227ec8f012151c0e0759f98e9fe3d3ce6ffa6dbb4ad7dc27c9e07d04",
    "cd5abf786dd47446e8ff160139ce3f22eec62b8e4a950162d109752f530622f0",
    "8a75fa7ab41860b2cbcc5674fcc09b921e277525531f78f622d96590ca7c795d",
    "359ff39baf1e67363e967436e1fa5602e21b809d77a1bd13af11191b9dcc3f48",
    "14f41ac02307dd3fbe6a2be2ebfb4beb9b5841a19c69b5783d297e266bc3aa10",
    "0efe0bfe82a49797cf501681dfe639da1817affd900ba46ecc0d45770d521130",
    "e1ae1b8aaed0a831aa014a0ec78612ccc35d111924382e6217a3b126ecc4d46f",
    "e6d7b7fc204da0abdf9f5151d26c3324415844d8430d6fd0707e0a30336f1653",
    "d4f3d33f110eb8d255d71d81a89b2cf9b0a0edfe67b9e1726c7f78020bfde5c9",
    "e6ea30f5d4550b4fd619e35232465159198369951922a45821034b6880170e96",
    "3c9a42479f8b9a53970eb54202ee9a542814269b206421ddba999bd20e0630a6",
    "6c3420331e252c19bfde0480ec113600883d8a3bf242e453a98c9b988f29eb09",
    "a20a61865f2b63407ecf6d65afa6c66a40298ad8e32a9bd3c04590e7eefc706f",
    "0af2aa26510840317b7a185de772e7737ae1eee22b892ce709fbb18c4188361a",
    "70b4f7b4b4244248fc5f3d191c0f8fa3d0cf04ef79d18cad263680ee8c72344d",
    "27346762261b22e49948af469a0e0180f2ce012510d6fefbc8a13443873c99e0",
    "338eda8cf191c46b8d3bf623d49c618f6c66b3572043f68645eae5278639dfd7",
    "f395eb8a069cb6e27800ae01c6cf171872507a5e43b20b0a621acb30743d2d9c",
    "544969c7e140861c5fd75451ecc4fa034b82b238d01e3b8f1998366bcbc6fc9f",
    "d080d937aa68e3267ab9c90a8628c1a65c41c9124e03b4f4366b50fbbd56e0e2",
    "ef61861c84bfd2d1e400a4d5e14918645bea7e793fb43f19a0b3f5230f6df0f4",
    "a74164a84fe0a1c6537c7365decc8be05ef769cf61867572f729204e99ead3b6",
    "940611330fce98e3947fbaf7a895b322b99af6af73f2b70c2ec64957b221c6eb",
    "a46d91864b21dbd0ae6faad2f12f3c7c7f9876d5cb8d986af38480251fc98617",
    "e8f0ea614de66951157fb7fbe80fb87dff70d4dc453ec4b5cee7e56e114d890f",
    "ca8e07c6685128257174cef75ddd1adfeb72cce5faeb2be2ec3b235d9acac9e8",
    "344f4d9475754209389804ed387e214300bf21f10c479d6412648b2702a6d034",
    "a76a947eb2149fe6d5522c405286b2b2af8fc0ab3108c746dbb30225a2f307b4",
    "9e2c0dd959541c6be0a61e3050c2bb046e2fff074f870a8b8528f060d9feddae",
    "73d034bf14957041ed35f906f6f8e6a48396e68228cc4156ab2be0f5f6bb3f79",
    "df5458cdf86838bccb797fdf258ae67b400a3f4e617c57d7be02c8880c678e47",
    "cd3c3ccd72c6309b8461f46f53e9695b9c98d57693410a97c996b2b074e84237",
    "ecfa310be9e52311c11d46e918549c176a805b37e46cf29e408b72f36e24f8fc",
    "621c4b22e73254ec8b6f1cdbc979dcbcd424e8424f1f42864e457faff3f4b334",
    "bbddb9352393cc6d750a0beffbb26a903296c11e85005d2a8a116bcb1bd47a84",
    "7a4d409d0abe144ead470640c399cf6c3bdc2366e4b2201654a1e9602b219083",
    "b37a70d54a80620ee406542236ad2d3e3ba1ba77988c92afc8ed501063beb5df",
    "158f64f8f23fae285de2098c28a3dc120a06a7079ab17af9fc2c5869a56c0a87",
    "e2b77f3e4b7b8f305a63296ce57d05fb7e2de1ea5c62051052b643365d28bd12",
    "5da53d87b9e48d940e05e8cca909a1afb60de9f42ad2c86b660915bfbfa4d47d",
    "a46a53360f7588a15cfab47ef8befb3d0f501a16255a352ff44895c5872e21c1",
    "42af89064085608cdb4c305aef2c86acd704690d5adebd646db3d7765cf8f45a",
    "d9c3bdecfa2ea05ed4c1963dc2227fae9523518a3f4c8cbde59be6b8fac66dbe",
    "6f265715d70222b1bc2f81e5cdd8e9dc279b0235f2f205acda6a338d87be843b",
    "6033e363faca878b0e642b7563f131c462f1c5537a140fb40b56786d1e0ac375",
    "4571cda2386ad87324d80b2e3006b98dfd906604672864b05a482efcf1214407",
    "dca1fecf356f9bba318b9e6743d3962e6e8d2ed065c87bb601841b24923fb8ab",